{
  "version": 1,
  "catalog_id": "cute_trace_v1",
  "description": "CUTETrace 的种子 catalog。Phase 0.6 从 cute_inst 和 cute_task trace 事件开始，并补齐 CML/Vector store trace 的外围事件。",
  "categories": [
    {
      "name": "cute_inst",
      "id": 0,
      "description": "发往 CUTE 的指令、完成、程序退出相关观测。"
    },
    {
      "name": "cute_task",
      "id": 1,
      "description": "CUTE 内部 task 的 issue、start、end、commit 生命周期。"
    },
    {
      "name": "cute_loadstore",
      "id": 2,
      "description": "CUTE 内部 load 读取和 store 写回的观测。"
    },
    {
      "name": "cute_compute",
      "id": 3,
      "description": "MTE 计算输入、输出和结果的观测。"
    },
    {
      "name": "vector_loadstore",
      "id": 4,
      "description": "vector 与 CUTE 配合时的访存观测。"
    }
  ],
  "modules": [
    {
      "name": "TaskController",
      "id": 1,
      "description": "CUTE 宏指令/微指令调度与生命周期管理模块。"
    },
    {
      "name": "AML",
      "id": 2,
      "description": "A 张量加载模块。"
    },
    {
      "name": "BML",
      "id": 3,
      "description": "B 张量加载模块。"
    },
    {
      "name": "CML",
      "id": 4,
      "description": "C/D 张量加载与 store 写回模块。"
    },
    {
      "name": "MTE",
      "id": 5,
      "description": "矩阵张量计算引擎。"
    },
    {
      "name": "LocalMMU",
      "id": 6,
      "description": "CUTE 本地 MMU 与内存请求路由模块。"
    },
    {
      "name": "Vector",
      "id": 7,
      "description": "Vector 单元与 CUTE 配合时的访存观测模块。"
    }
  ],
  "tasks": [
    {
      "name": "TaskControllerTrace",
      "id": 1,
      "module": "TaskController",
      "method_group": "TaskControllerTrace",
      "description": "TaskController 的宏/微任务生命周期 trace 组。"
    },
    {
      "name": "AMLLoad",
      "id": 2,
      "module": "AML",
      "method_group": "AMLLoad",
      "description": "A 张量加载任务 trace 组。"
    },
    {
      "name": "BMLLoad",
      "id": 3,
      "module": "BML",
      "method_group": "BMLLoad",
      "description": "B 张量加载任务 trace 组。"
    },
    {
      "name": "CMLLoad",
      "id": 4,
      "module": "CML",
      "method_group": "CMLLoad",
      "description": "C 张量加载任务 trace 组。"
    },
    {
      "name": "CMLStore",
      "id": 5,
      "module": "CML",
      "method_group": "CMLStore",
      "description": "D 张量 store 任务 trace 组。"
    },
    {
      "name": "MTECompute",
      "id": 6,
      "module": "MTE",
      "method_group": "MTECompute",
      "description": "MTE 计算任务 trace 组。"
    },
    {
      "name": "VectorStore",
      "id": 7,
      "module": "Vector",
      "method_group": "VectorStore",
      "description": "Vector store 任务 trace 组。"
    }
  ],
  "events": [
    {
      "name": "TaskControllerTrace.macroInstInsert",
      "method": "macroInstInsert",
      "id": 1,
      "task": "TaskControllerTrace",
      "category": "cute_inst",
      "description": "向 TaskController 插入一条宏指令。",
      "fields": [
        {
          "name": "macro_id",
          "type": "uint",
          "fmt": "dec"
        },
        {
          "name": "opcode",
          "type": "uint",
          "fmt": "hex"
        }
      ],
      "render": "macro_id={macro_id} opcode=0x{opcode:x}"
    },
    {
      "name": "TaskControllerTrace.macroInstDecodeStart",
      "method": "macroInstDecodeStart",
      "id": 2,
      "task": "TaskControllerTrace",
      "category": "cute_inst",
      "description": "TaskController 开始解码一条宏指令。",
      "fields": [
        {
          "name": "macro_id",
          "type": "uint",
          "fmt": "dec"
        },
        {
          "name": "opcode",
          "type": "uint",
          "fmt": "hex"
        }
      ],
      "render": "macro_id={macro_id} opcode=0x{opcode:x}"
    },
    {
      "name": "TaskControllerTrace.macroInstDecodeEnd",
      "method": "macroInstDecodeEnd",
      "id": 3,
      "task": "TaskControllerTrace",
      "category": "cute_inst",
      "description": "TaskController 完成一条宏指令的解码。",
      "fields": [
        {
          "name": "macro_id",
          "type": "uint",
          "fmt": "dec"
        },
        {
          "name": "load_tasks",
          "type": "uint",
          "fmt": "dec"
        },
        {
          "name": "compute_tasks",
          "type": "uint",
          "fmt": "dec"
        },
        {
          "name": "store_tasks",
          "type": "uint",
          "fmt": "dec"
        }
      ],
      "render": "macro_id={macro_id} load_tasks={load_tasks} compute_tasks={compute_tasks} store_tasks={store_tasks}"
    },
    {
      "name": "TaskControllerTrace.microTaskIssue",
      "method": "microTaskIssue",
      "id": 4,
      "task": "TaskControllerTrace",
      "category": "cute_task",
      "description": "TaskController 向内部模块发出一条微任务。",
      "fields": [
        {
          "name": "macro_id",
          "type": "uint",
          "fmt": "dec"
        },
        {
          "name": "micro_id",
          "type": "uint",
          "fmt": "dec"
        },
        {
          "name": "target_task_id",
          "type": "uint",
          "fmt": "dec"
        }
      ],
      "render": "macro_id={macro_id} micro_id={micro_id} target_task_id={target_task_id}"
    },
    {
      "name": "TaskControllerTrace.microTaskCommit",
      "method": "microTaskCommit",
      "id": 5,
      "task": "TaskControllerTrace",
      "category": "cute_task",
      "description": "TaskController 提交一条已完成的微任务。",
      "fields": [
        {
          "name": "macro_id",
          "type": "uint",
          "fmt": "dec"
        },
        {
          "name": "micro_id",
          "type": "uint",
          "fmt": "dec"
        },
        {
          "name": "target_task_id",
          "type": "uint",
          "fmt": "dec"
        }
      ],
      "render": "macro_id={macro_id} micro_id={micro_id} target_task_id={target_task_id}"
    },
    {
      "name": "AMLLoad.taskStart",
      "method": "taskStart",
      "id": 6,
      "task": "AMLLoad",
      "category": "cute_task",
      "description": "AML 开始一个加载微任务。",
      "fields": [
        {
          "name": "task_count",
          "type": "uint",
          "fmt": "dec"
        }
      ],
      "render": "task_count={task_count}"
    },
    {
      "name": "AMLLoad.taskEnd",
      "method": "taskEnd",
      "id": 7,
      "task": "AMLLoad",
      "category": "cute_task",
      "description": "AML 完成一个加载微任务。",
      "fields": [
        {
          "name": "task_count",
          "type": "uint",
          "fmt": "dec"
        }
      ],
      "render": "task_count={task_count}"
    },
    {
      "name": "BMLLoad.taskStart",
      "method": "taskStart",
      "id": 8,
      "task": "BMLLoad",
      "category": "cute_task",
      "description": "BML 开始一个加载微任务。",
      "fields": [
        {
          "name": "task_count",
          "type": "uint",
          "fmt": "dec"
        }
      ],
      "render": "task_count={task_count}"
    },
    {
      "name": "BMLLoad.taskEnd",
      "method": "taskEnd",
      "id": 9,
      "task": "BMLLoad",
      "category": "cute_task",
      "description": "BML 完成一个加载微任务。",
      "fields": [
        {
          "name": "task_count",
          "type": "uint",
          "fmt": "dec"
        }
      ],
      "render": "task_count={task_count}"
    },
    {
      "name": "CMLLoad.taskStart",
      "method": "taskStart",
      "id": 10,
      "task": "CMLLoad",
      "category": "cute_task",
      "description": "CML 开始一个加载 C 张量的微任务。",
      "fields": [
        {
          "name": "task_count",
          "type": "uint",
          "fmt": "dec"
        }
      ],
      "render": "task_count={task_count}"
    },
    {
      "name": "CMLLoad.taskEnd",
      "method": "taskEnd",
      "id": 11,
      "task": "CMLLoad",
      "category": "cute_task",
      "description": "CML 完成一个加载 C 张量的微任务。",
      "fields": [
        {
          "name": "task_count",
          "type": "uint",
          "fmt": "dec"
        }
      ],
      "render": "task_count={task_count}"
    },
    {
      "name": "CMLStore.taskStart",
      "method": "taskStart",
      "id": 12,
      "task": "CMLStore",
      "category": "cute_task",
      "description": "CML 开始一个写回 D 张量的微任务。",
      "fields": [
        {
          "name": "task_count",
          "type": "uint",
          "fmt": "dec"
        }
      ],
      "render": "task_count={task_count}"
    },
    {
      "name": "CMLStore.taskEnd",
      "method": "taskEnd",
      "id": 13,
      "task": "CMLStore",
      "category": "cute_task",
      "description": "CML 完成一个写回 D 张量的微任务。",
      "fields": [
        {
          "name": "task_count",
          "type": "uint",
          "fmt": "dec"
        }
      ],
      "render": "task_count={task_count}"
    },
    {
      "name": "MTECompute.taskStart",
      "method": "taskStart",
      "id": 14,
      "task": "MTECompute",
      "category": "cute_task",
      "description": "MTE 开始一个计算微任务。",
      "fields": [
        {
          "name": "task_count",
          "type": "uint",
          "fmt": "dec"
        }
      ],
      "render": "task_count={task_count}"
    },
    {
      "name": "MTECompute.taskEnd",
      "method": "taskEnd",
      "id": 15,
      "task": "MTECompute",
      "category": "cute_task",
      "description": "MTE 完成一个计算微任务。",
      "fields": [
        {
          "name": "task_count",
          "type": "uint",
          "fmt": "dec"
        }
      ],
      "render": "task_count={task_count}"
    },
    {
      "name": "CMLStore.storeData",
      "method": "storeData",
      "id": 16,
      "task": "CMLStore",
      "category": "cute_loadstore",
      "description": "CML 向外部存储写回一笔 D tensor 数据。",
      "fields": [
        {
          "name": "task_count",
          "type": "uint",
          "fmt": "dec"
        },
        {
          "name": "vaddr",
          "type": "uint",
          "fmt": "hex"
        },
        {
          "name": "data",
          "type": "uint",
          "fmt": "hex"
        }
      ],
      "render": "task_count={task_count} vaddr=0x{vaddr:x} data=0x{data:x}"
    },
    {
      "name": "VectorStore.storeData",